cd_ref,famille,nom_valide,nom_cite,cd_nom,nom_reconnu,nom_reconnu_ss_date,nom_reconnu_ss_auteur,ID,rang_taxinomique,N°_Taxinomique_BDNFF,N°_Nomenclatural_BDNFF,code_CATMINAT,NOM_SCIENTIFIQUE,CHOROLOGIE,inflorescence,sexualité,ordre_maturation,pollinisation,fruit,dissémination,couleur_fleur,macule,floraison,type_ligneux,Champ17,TYPE_BIOLOGIQUE,FORMATION_VEGETALE,CARACT_ECOLOG_HABITAT_OPTI,INDICATION_PHYTOSOCIOLOGIQUE_CARACTERISTIQUE,INDICATION_CARACTERISTIQUE_TRANSGRESSIVE,INDICATION_DIFFERENTIELLE_1,INDICATION_DIFFERENTIELLE_2,INDICATION_DIFFERENTIELLE_3,Lumière,Température,Continentalité,Humidité_atmosphérique,Humidité_édaphique,Réaction_du_sol_(pH),Niveau_trophique,Salinité,Texture,Matière_organique,Lichtzahl,Temperaturzahl,Kontinentalität,Feuchtzahl,Reaktionszahl,Nutrients,Salz,CLASSE_(-opsida),SUBCLASSE_(-idae),Clade_intermédiaire,SUPERORDRE_(-anae),Champ47,Champ48,Champ49,ORDRE_(-ales),FAMILLE_(-aceae),numSpA,numSpB,numSpH,nomA,nomB,nomH
79783,Sapindaceae,"Acer pseudoplatanus L., 1753","Acer pseudoplatanus L., 1753",79783,"Acer pseudoplatanus L., 1753",Acer pseudoplatanus L.,Acer pseudoplatanus,30,esp,11,210,18/1.,Acer pseudoplatanus L.,européen,racème de cymes unipares scorpioïdes,polygame,,anémogame,samare,anémochore,vert,,5,arbre,38,A-cad,magnophanérophytaie,"associations arborescentes des forêts et bois caducifoliés climaciques, malacophylles, du tempéré modal médio-européen",σA Fraxino excelsioris - Quercetea roboris Gillet 1986 ex Julve 1993,,,,,7,5,5,6,5,5,7,0,3,3,-4,,4,6,x,7,0,Magnoliopsida,Magnoliidae,Eudicots,Rosanae,,,Rosids,Sapindales,Sapindaceae,1985,7013,7021,Acer pseudoplatanus A,Acer pseudoplatanus B,Acer pseudoplatanus H
80564,Poaceae,"Agrostis alpina Scop., 1771",Agrostis alpina,80564,"Agrostis alpina Scop., 1771",Agrostis alpina Scop.,Agrostis alpina,45,esp,6589,1539,11/7.0.1,Agrostis alpina Scop.,orophyte méridional,panicule d'épillets,hermaphrodite,,anémogame,caryopse,anémochore,rose,,8-Jul,,,hces,hémicryptophytaie,"pelouses basophiles arctico-alpines climaciques, chionophobes, européennes occidentales",Caricetalia myosuroidis Oberdorfer 1957,,,,,8,2,4,5,5,6,3,0,5,7,8,2,3,5,6,4,0,Magnoliopsida,Magnoliidae,Monocots,Lilianae,,,Commelinids,Poales,Poaceae,0,0,197,,,Agrostis alpina
81179,Rosaceae,"Alchemilla transiens (Buser) Buser, 1898",Alchemilla transiens,81179,"Alchemilla transiens (Buser) Buser, 1898",Alchemilla transiens (Buser) Buser,Alchemilla transiens,49,esp,4635,2696,09/1.0.2,Alchemilla transiens (Buser) Buser,orophyte occidental,glomérules,hermaphrodite,,apogame,akène,épizoochore,vert,,8-Jun,,,heri,hémicryptophytaie,pelouses acidophiles montagnardes à subalpines,Trifolio alpini - Meetalia athamantici de Foucault 1994,,,,,8,3,4,6,5,4,3,0,3,5,,,,,,,,Magnoliopsida,Magnoliidae,Eudicots,Rosanae,,,Rosids,Rosales,Rosaceae,0,0,11634,,,Alchemilla transiens
130729,Asteraceae,"Achillea erba-rotta subsp. moschata (Wulfen) Vacc., 1909","Achillea erba-rotta subsp. moschata (Wulfen) Vacc., 1909",130729,"Achillea erba-rotta subsp. moschata (Wulfen) Vacc., 1909",Achillea erba-rotta subsp. moschata (Wulfen) Vacc.,Achillea erba-rotta subsp. moschata,71,esp,361,334,08/20.0.1.0.1,Achillea erba-rotta subsp. moschata (Wulfen) Vacc.,orophyte alpien mérid.,corymbe de capitules,hermaphrodite,,entomogame,akène,anémochore,blanc,,8-Jul,,,hsto,hémicryptophytaie,"grpts vivaces des éboulis médio-européens, acidophiles, orophiles, alpiens",Androsacion alpinae Braun-Blanquet in Braun-Blanquet & Jenny 1926,,,,,8,2,8,5,5,3,2,0,6,1,9,1,4,6,3,2,0,Magnoliopsida,Magnoliidae,Eudicots,Asteranae,,,Asterids,Asterales,Asteraceae,0,0,3184,,,Achillea erba-rotta
79913,Asteraceae,"Achillea nana L., 1753","Achillea nana L., 1753",79913,"Achillea nana L., 1753",Achillea nana L.,Achillea nana,81,esp,369,398,08/20.0.1.0.1,Achillea nana L.,orophyte alpien,corymbe de capitules,hermaphrodite,,entomogame,akène,anémochore,blanc,,8-Jul,,,heri,hémicryptophytaie,"grpts vivaces des éboulis médio-européens, acidophiles, orophiles, alpiens",Androsacion alpinae Braun-Blanquet in Braun-Blanquet & Jenny 1926,,,,,8,1,7,6,6,3,2,0,6,1,8,1,3,6,6,2,0,Magnoliopsida,Magnoliidae,Eudicots,Asteranae,,,Asterids,Asterales,Asteraceae,0,0,3185,,,Achillea erb. moschata
80183,Asteraceae,"Adenostyles alliariae (Gouan) A.Kern., 1871","Adenostyles alliariae (Gouan) A.Kern., 1871",80183,"Adenostyles alliariae (Gouan) A.Kern., 1871",Adenostyles alliariae (Gouan) A.Kern.,Adenostyles alliariae,123,esp,8540,790,05/1.0.1.0.1,Adenostyles alliariae (Gouan) A.Kern.,orophyte méridional,corymbe de capitules,hermaphrodite,,"entomogame, autogame",akène,anémochore,rose,,8-Jul,,,Heri,hémicryptophytaie,"mégaphorbiaies subalpines, hygrophiles, mésotrophiles, basophiles, des adrets",Adenostylion alliariae Braun-Blanquet 1926,,,,,6,2,6,8,7,7,8,0,1,8,6,3,2,6,x,8,0,Magnoliopsida,Magnoliidae,Eudicots,Asteranae,,,Asterids,Asterales,Asteraceae,0,0,3037,,,Adenostyles alliariae
80184,Asteraceae,"Adenostyles alpina (L.) Bluff & Fingerh., 1825","Adenostyles alpina (L.) Bluff & Fingerh., 1825",80184,"Adenostyles alpina (L.) Bluff & Fingerh., 1825",Adenostyles alpina (L.) Bluff & Fingerh.,Adenostyles alpina,124,esp,29930,74938,05/1.0.1.0.13,Adenostyles alpina (L.) Bluff & Fingerh.,orophyte méridional,corymbe de capitules,hermaphrodite,,"entomogame, autogame",akène,anémochore,rose,,8-Jun,,,heri,hémicryptophytaie,,"Adenostylion alpinae Castelli, Biondi & Ballelli 2001 ex Castelli, Biondi & Ballelli in Biondi, Allegrezza, Casavecchia, Galdenzi, Gasparri, Pesaresi, Vagge & Blasi 2014",,,,,6,2,5,6,6,7,7,0,2,3,,,,,,,,Magnoliopsida,Magnoliidae,Eudicots,Asteranae,,,Asterids,Asterales,Asteraceae,0,0,13506,,,Achillea x feliciana *
80190,Asteraceae,"Adenostyles leucophylla (Willd.) Rchb., 1831","Adenostyles leucophylla (Willd.) Rchb., 1831",80190,"Adenostyles leucophylla (Willd.) Rchb., 1831",Adenostyles leucophylla (Willd.) Rchb.,Adenostyles leucophylla,128,esp,380,807,08/20.0.1.0.1,Adenostyles leucophylla (Willd.) Rchb.,orophyte alpien occ.,corymbe de capitules,hermaphrodite,,"entomogame, autogame",akène,anémochore,rose,,8-Jul,,,heri,hémicryptophytaie,"grpts vivaces des éboulis médio-européens, acidophiles, orophiles, alpiens",Androsacion alpinae Braun-Blanquet in Braun-Blanquet & Jenny 1926,,,,,8,2,8,5,5,3,2,0,6,1,,,,,,,,Magnoliopsida,Magnoliidae,Eudicots,Asteranae,,,Asterids,Asterales,Asteraceae,0,0,13489,,,Achillea x obscura *
80729,Poaceae,"Agrostis rupestris All., 1785","Agrostis rupestris All., 1785",80729,"Agrostis rupestris All., 1785",Agrostis rupestris All.,Agrostis rupestris,179,esp,8556,1842,11/5.0.1.0.1,Agrostis rupestris All.,orophyte méridional,panicule d'épillets,hermaphrodite,,anémogame,caryopse,anémochore,rose,,8-Jun,,,hces,hémicryptophytaie,"pelouses acidophiles alpino-alpiennes climaciques, chionophobes",Caricion curvulae subsp. curvulae Braun-Blanquet 1925,,,,,8,2,3,5,4,2,1,0,5,1,8,2,2,4,2,1,0,Magnoliopsida,Magnoliidae,Monocots,Lilianae,,,Commelinids,Poales,Poaceae,0,0,199,,,Agrostis rupestris
80741,Poaceae,"Agrostis schraderiana Bech., 1938","Agrostis schraderiana Bech., 1938",80741,"Agrostis schraderiana Bech., 1938",Agrostis schraderiana Bech.,Agrostis schraderiana,185,esp,6588,1870,09/20.0.1.0.7,Agrostis schraderiana Bech.,orophyte alpien,panicule d'épillets,hermaphrodite,,anémogame,caryopse,barochore,,,,,,hsto,hémicryptophytaie,"pelouses basophiles subalpines, alpiennes, mésohygrophiles",Caricion ferrugineae Braun-Blanquet 1931,,,,,7,2,7,6,6,6,5,0,5,3,6,2,6,5,6,6,0,Magnoliopsida,Magnoliidae,Monocots,Lilianae,,,Commelinids,Poales,Poaceae,0,0,194,,,Agrostis agrostiflora
81032,Rosaceae,"Alchemilla alpigena Buser, 1894","Alchemilla alpigena Buser, 1894",81032,"Alchemilla alpigena Buser, 1894",Alchemilla alpigena Buser,Alchemilla alpigena,222,esp,4660,2461,09/20.0.1.0.7,Alchemilla alpigena Buser,orophyte alpien,glomérules,hermaphrodite,,apogame,akène,épizoochore,vert,,8-Jun,,,heri,hémicryptophytaie,"pelouses basophiles subalpines, alpiennes, mésohygrophiles",Caricion ferrugineae Braun-Blanquet 1931,,,,,7,2,7,6,6,7,5,0,3,3,,,,,,,,Magnoliopsida,Magnoliidae,Eudicots,Rosanae,,,Rosids,Rosales,Rosaceae,0,0,4055,,,Alchemilla plicatula
81033,Rosaceae,"Alchemilla alpina L., 1753","Alchemilla alpina L., 1753",81033,"Alchemilla alpina L., 1753",Alchemilla alpina L.,Alchemilla alpina,223,esp,29887,74732,09/1.0.2,Alchemilla alpina L.,arctico-alpin,glomérules,hermaphrodite,,apogame,akène,épizoochore,vert,,8-Jul,,,heri,hémicryptophytaie,pelouses acidophiles montagnardes à subalpines,Trifolio alpini - Meetalia athamantici de Foucault 1994,,,,,9,2,4,6,5,2,2,0,3,5,9,2,2,5,2,2,0,Magnoliopsida,Magnoliidae,Eudicots,Rosanae,,,Rosids,Rosales,Rosaceae,0,0,1543,,,Alchemilla alpina
81055,Rosaceae,"Alchemilla colorata Buser, 1892",Alchemilla colorata,81055,"Alchemilla colorata Buser, 1892",Alchemilla colorata Buser,Alchemilla colorata,226,esp,4638,2512,09/20.,Alchemilla colorata Buser,orophyte alpien,glomérules,hermaphrodite,,apogame,akène,épizoochore,vert,,,,,heri,hémicryptophytaie,"pelouses basophiles subalpines, pionnières, chionophiles",Seslerietea caeruleae Braun-Blanquet 1948 em. Oberdorfer 1978,,,,,8,2,7,6,4,7,2,0,3,7,8,2,3,4,7,2,0,Magnoliopsida,Magnoliidae,Eudicots,Rosanae,,,Rosids,Rosales,Rosaceae,0,0,4001,,,Alchemilla colorata
81075,Rosaceae,"Alchemilla fissa Günther & Schummel, 1819",Alchemilla fissa,81075,"Alchemilla fissa Günther & Schummel, 1819",Alchemilla fissa Günther & Schummel,Alchemilla fissa,239,esp,5013,2544,11/6.0.1.0.1,Alchemilla fissa Günther & Schummel,orophyte alpien,glomérules,hermaphrodite,,apogame,akène,épizoochore,vert,,,,,heri,hémicryptophytaie,"pelouses alpines climaciques chionophiles, acidophiles",Salicion herbaceae Braun-Blanquet in Braun-Blanquet & Jenny 1926,,,,,8,2,4,7,6,5,3,0,5,7,8,2,4,6,x,3,0,Magnoliopsida,Magnoliidae,Eudicots,Rosanae,,,Rosids,Rosales,Rosaceae,0,0,1547,,,Alchemilla fissa
81088,Rosaceae,"Alchemilla glabra Neygenf., 1821",Alchemilla glabra,81088,"Alchemilla glabra Neygenf., 1821",Alchemilla glabra Neygenf.,Alchemilla glabra,244,esp,4653,2564,12/1.1.2,Alchemilla glabra Neygenf.,européen septentrional,glomérules,hermaphrodite,,apogame,akène,épizoochore,vert,,,,,heri,hémicryptophytaie,"prairies mésohydriques, subalpines à montagnardes supérieures","Poo alpinae - Trisetetalia flavescentis Ellmauer & Mucina in Mucina, Grabherr & Ellmauer 1993",,,,,7,3,6,7,5,5,5,0,2,3,,,,,,,,Magnoliopsida,Magnoliidae,Eudicots,Rosanae,,,Rosids,Rosales,Rosaceae,0,0,1555,,,Alchemilla glabra
81140,Rosaceae,"Alchemilla pentaphyllea L., 1753",Alchemilla pentaphyllea,81140,"Alchemilla pentaphyllea L., 1753",Alchemilla pentaphyllea L.,Alchemilla pentaphyllea,261,esp,4671,2642,11/6.0.1.0.1,Alchemilla pentaphyllea L.,orophyte alpien,glomérules,hermaphrodite,,apogame,akène,épizoochore,vert,,8-Jul,,,heri,hémicryptophytaie,"pelouses alpines climaciques chionophiles, acidophiles",Salicion herbaceae Braun-Blanquet in Braun-Blanquet & Jenny 1926,,,,,7,2,3,7,7,3,4,0,5,7,7,2,2,7,3,4,0,Magnoliopsida,Magnoliidae,Eudicots,Rosanae,,,Rosids,Rosales,Rosaceae,0,0,1542,,,Alchemilla pentaphyllea
81159,Rosaceae,"Alchemilla saxatilis Buser, 1891","Alchemilla saxatilis Buser, 1891",81159,"Alchemilla saxatilis Buser, 1891",Alchemilla saxatilis Buser,Alchemilla saxatilis,266,esp,4677,2669,08/2.1.1,Alchemilla saxatilis Buser,orophyte méridional,glomérules,hermaphrodite,,apogame,akène,épizoochore,vert,,8-Jun,,,heri,hémicryptophytaie,"lithophytes des replats de falaises européennes, acidophiles, subalpines à alpines",Androsacetalia vandellii Braun-Blanquet in Meier & Braun-Blanquet 1934,,,,,7,2,5,5,5,3,2,0,5,5,,,,,,,,Magnoliopsida,Magnoliidae,Eudicots,Rosanae,,,Rosids,Rosales,Rosaceae,0,0,13696,,,Gagea luberonensis *
81563,Betulaceae,"Alnus alnobetula (Ehrh.) K.Koch, 1872","Alnus viridis (Chaix) DC., 1805",81579,"Alnus alnobetula (Ehrh.) K.Koch, 1872",Alnus alnobetula (Ehrh.) K.Koch,Alnus alnobetula,335,ane,8583,3307,15/4.0.1.0.1,Alnus alnobetula (Ehrh.) K.Koch,européen,épi de cymes triflores,monoïque,,anémogame,akène,anémochore,vert,,6-Apr,arbrisseau,4,b-cad,nanophanérophytaie,"buissons d'arbrisseaux mésohydriques, des zones d'éboulis subalpins",Alnion alnobetulae Schnyder 1930,,,,,7,3,5,7,6,5,7,0,3,3,7,3,4,6,5,7,0,Magnoliopsida,Magnoliidae,Eudicots,Rosanae,,,Rosids,Fagales,Betulaceae,0,828,7144,,Alnus viridis B,Alnus viridis H
81638,Poaceae,"Alopecurus gerardi Vill., 1786",Alopecurus gerardi,81638,"Alopecurus gerardi Vill., 1786",Alopecurus gerardi Vill.,Alopecurus gerardi,350,esp,6616,3445,09/1.0.2.0.5,Alopecurus gerardi Vill.,orophyte méridional,épi d'épillets,hermaphrodite,,anémogame,caryopse,barochore,blanc,,8-Jul,,,hsto,hémicryptophytaie,"pelouses acidophiles ouvertes, alpines, mésohydriques, des adrets alpiens",Festucion acuminatae Braun-Blanquet 1926,,,,,8,2,4,5,5,3,2,0,3,4,,,,,,,,Magnoliopsida,Magnoliidae,Monocots,Lilianae,,,Commelinids,Poales,Poaceae,0,0,214,,,Alopecurus gerardii
82478,Primulaceae,"Androsace alpina (L.) Lam., 1779","Androsace alpina (L.) Lam., 1779",82478,"Androsace alpina (L.) Lam., 1779",Androsace alpina (L.) Lam.,Androsace alpina,477,esp,4316,4585,08/20.0.1.0.1,Androsace alpina (L.) Lam.,orophyte alpien,ombelle simple,hermaphrodite,,entomogame,capsule,barochore,"blanc, rose",jaune,9-Jul,,,ccou,hémicryptophytaie,"grpts vivaces des éboulis médio-européens, acidophiles, orophiles, alpiens",Androsacion alpinae Braun-Blanquet in Braun-Blanquet & Jenny 1926,,,,,8,1,8,5,5,2,2,0,4,1,9,1,,6,2,3,0,Magnoliopsida,Magnoliidae,Eudicots,Asteranae,,,Asterids,Ericales,Primulaceae,0,0,3035,,,Adenostyles leucophylla
82519,Primulaceae,"Androsace obtusifolia All., 1785","Androsace obtusifolia All., 1785",82519,"Androsace obtusifolia All., 1785",Androsace obtusifolia All.,Androsace obtusifolia,490,esp,4329,4650,11/5.0.1.0.1,Androsace obtusifolia All.,orophyte alpien,ombelle simple,hermaphrodite,,entomogame,capsule,barochore,"blanc, rose",,8-Jun,,,hces,hémicryptophytaie,"pelouses acidophiles alpino-alpiennes climaciques, chionophobes",Caricion curvulae subsp. curvulae Braun-Blanquet 1925,,,,,8,2,4,5,5,1,1,0,4,1,8,2,4,5,1,1,0,Magnoliopsida,Magnoliidae,Eudicots,Asteranae,,,Asterids,Ericales,Primulaceae,0,0,2322,,,Androsace obtusifolia
82529,Primulaceae,"Androsace pubescens DC., 1805","Androsace pubescens DC., 1805",82529,"Androsace pubescens DC., 1805",Androsace pubescens DC.,Androsace pubescens,491,esp,4330,4661,08/2.2.1.0.10,Androsace pubescens DC.,orophyte alpien occ.,ombelle simple,hermaphrodite,,entomogame,capsule,barochore,blanc,jaune,8-Jun,,,ccou,hémicryptophytaie,"lithophytes des dalles en pente de falaises basophiles, subalpins à montagnards, alpiens et auvergnat",Potentillion caulescentis Braun-Blanquet in Braun-Blanquet & Jenny 1926,,Noccaeetalia rotundifoliae Braun-Blanquet in Braun-Blanquet & Jenny 1926 em. Seibert in Oberdorfer 1977,,,8,1,7,5,5,8,3,0,7,1,,,,,,,,Magnoliopsida,Magnoliidae,Eudicots,Asteranae,,,Asterids,Ericales,Primulaceae,0,0,1316,,,Alyssum alpestre
82796,Asteraceae,"Antennaria dioica (L.) Gaertn., 1791","Antennaria dioica (L.) Gaertn., 1791",82796,"Antennaria dioica (L.) Gaertn., 1791",Antennaria dioica (L.) Gaertn.,Antennaria dioica,559,esp,398,5011,09/1.,Antennaria dioica (L.) Gaertn.,circumboréal,épi de capitules,"hermaphrodite, dioïque",,apogame,akène,anémochore,"blanc, rose",,6-May,,,hsto,hémicryptophytaie,pelouses acidophiles médio-européennes à boréo-subalpines,Nardetea strictae Rivas Goday & Borja-Carbonell 1961 em. de Foucault 1994,,Genisto sagittalis - Agrostienion capillaris Vigo 1979,,,8,4,5,5,4,3,2,0,4,4,8,,,4,3,2,0,Magnoliopsida,Magnoliidae,Eudicots,Asteranae,,,Asterids,Asterales,Asteraceae,0,0,3057,,,Antennaria dioica
82914,Poaceae,"Anthoxanthum alpinum Á.Löve & D.Löve, 1948","Anthoxanthum alpinum Á.Löve & D.Löve, 1948",82914,"Anthoxanthum alpinum Á.Löve & D.Löve, 1948",Anthoxanthum alpinum Á.Löve & D.Löve,Anthoxanthum alpinum,579,esp,6630,5182,11/5.,Anthoxanthum alpinum Á.Löve & D.Löve,arctico-alpin,panicule d'épillets,hermaphrodite,,anémogame,caryopse,épizoochore,jaune,,7-Apr,,,hces,hémicryptophytaie,"pelouses acidophiles arctico-alpines climaciques, chionophobes",Caricetea curvulae subsp. curvulae Braun-Blanquet 1948,,,,,7,2,4,6,5,2,2,0,3,7,7,3,,6,2,2,0,Magnoliopsida,Magnoliidae,Monocots,Lilianae,,,Commelinids,Poales,Poaceae,0,0,181,,,Anthoxanthum alpinum
82922,Poaceae,"Anthoxanthum odoratum L., 1753","Anthoxanthum odoratum L., 1753",82922,"Anthoxanthum odoratum L., 1753",Anthoxanthum odoratum L.,Anthoxanthum odoratum,581,esp,8622,5194,09/1.,Anthoxanthum odoratum L.,circumboréal,panicule d'épillets,hermaphrodite,,anémogame,caryopse,épizoochore,jaune,,7-Apr,,,hces,hémicryptophytaie,pelouses acidophiles médio-européennes à boréo-subalpines,Nardetea strictae Rivas Goday & Borja-Carbonell 1961 em. de Foucault 1994,,,,,7,5,5,5,5,4,4,0,4,4,,,,x,5,x,1,Magnoliopsida,Magnoliidae,Monocots,Lilianae,,,Commelinids,Poales,Poaceae,0,0,180,,,Anthoxanthum odoratum
82999,Fabaceae,"Anthyllis vulneraria L., 1753",Anthyllis vulneraria L.,82999,"Anthyllis vulneraria L., 1753",Anthyllis vulneraria L.,Anthyllis vulneraria,599,esp,8629,5363,09/3.,Anthyllis vulneraria L.,européen,racème capituliforme,hermaphrodite,,entomogame,gousse,anémochore,"blanc, jaune, rose",,8-May,,,hsto,hémicryptophytaie,pelouses basophiles médio-européennes et nevado-illyriennes,Festuco valesiacae - Bromopsidetea erectae Braun-Blanquet & Tüxen 1943 em. Royer 1987,,,,,8,5,4,4,3,7,2,0,3,2,8,6,3,3,7,2,0,Magnoliopsida,Magnoliidae,Eudicots,Rosanae,,,Rosids,Fabales,Fabaceae,0,0,1773,,,Anthyllis vulneraria
83279,Brassicaceae,"Arabis alpina L., 1753","Arabis alpina L., 1753",83279,"Arabis alpina L., 1753",Arabis alpina L.,Arabis alpina,646,esp,30440,75448,08/20.0.5.0.2,Arabis alpina L.,arctico-alpin,racème simple,hermaphrodite,,"entomogame, autogame",silique,anémochore,blanc,,7-Apr,,,hces,hémicryptophytaie,"grpts vivaces des éboulis grossiers de calcaires compacts, montagnards-subalpins, sciaphiles",Arabidion alpinae Béguin 1970,,,,,5,3,3,6,5,7,3,0,5,2,7,3,3,5,9,3,0,Magnoliopsida,Magnoliidae,Eudicots,Rosanae,,,Rosids,Brassicales,Brassicaceae,0,0,2844,,,Valeriana montana
83296,Brassicaceae,"Arabis caerulea (All.) Haenke, 1789","Arabis caerulea (All.) Haenke, 1789",83296,"Arabis caerulea (All.) Haenke, 1789",Arabis caerulea (All.) Haenke,Arabis caerulea,650,esp,1489,5816,11/6.0.2.0.1,Arabis caerulea (All.) Haenke,orophyte alpien,racème simple,hermaphrodite,,entomogame,silique,anémochore,bleu,,8-Jul,,,heri,hémicryptophytaie,"pelouses alpines climaciques chionophiles, basophiles",Arabidion caeruleae Braun-Blanquet in Braun-Blanquet & Jenny 1926,,,,,8,2,4,7,7,9,4,0,5,1,8,2,4,7,9,4,0,Magnoliopsida,Magnoliidae,Eudicots,Rosanae,,,Rosids,Brassicales,Brassicaceae,0,0,1420,,,Arabis caerulea
83303,Brassicaceae,"Arabis ciliata Clairv., 1811",Arabis ciliata Clairv.,83303,"Arabis ciliata Clairv., 1811",Arabis ciliata Clairv.,Arabis ciliata,652,esp,8638,5824,09/20.,Arabis ciliata Clairv.,orophyte méridional,racème simple,hermaphrodite,,entomogame,silique,barochore,blanc,,7-Jun,,,heri,hémicryptophytaie,"pelouses basophiles subalpines, pionnières, chionophiles",Seslerietea caeruleae Braun-Blanquet 1948 em. Oberdorfer 1978,,,,,9,2,7,5,5,9,3,0,3,2,9,2,4,5,9,3,0,Magnoliopsida,Magnoliidae,Eudicots,Rosanae,,,Rosids,Brassicales,Brassicaceae,0,0,1418,,,Arabis corymbiflora
83528,Ericaceae,"Arctostaphylos uva-ursi (L.) Spreng., 1825","Arctostaphylos uva-ursi (L.) Spreng., 1825",83528,"Arctostaphylos uva-ursi (L.) Spreng., 1825",Arctostaphylos uva-ursi (L.) Spreng.,Arctostaphylos uva-ursi,679,esp,8640,6116,14/4.0.2.0.1,Arctostaphylos uva-ursi (L.) Spreng.,circumboréal,ombelle simple,hermaphrodite,,"entomogame, autogame",baie,endozoochore,rose,,6-Apr,sous-arbrisseau,"0,2",Cfru,parvochaméphytaie,"landines alpines à subalpines, des adrets, chionophobes","Juniperion communis subsp. nanae Braun-Blanquet in Braun-Blanquet, Sissingh & Vlieger 1939",,,,,7,3,4,4,3,4,1,0,5,7,6,,5,3,x,2,0,Magnoliopsida,Magnoliidae,Eudicots,Asteranae,,,Asterids,Ericales,Ericaceae,0,0,2285,,,Arctostaphylos uva-ursi
83808,Plumbaginaceae,"Armeria alpina Willd., 1809","Armeria alpina Willd., 1809",83808,"Armeria alpina Willd., 1809",Armeria alpina Willd.,Armeria alpina,722,esp,4112,6495,11/5.0.1,Armeria alpina Willd.,orophyte méridional,cyme capituliforme,hermaphrodite,,entomogame,capsule,épizoochore,rose,,8-Jul,,,hces,hémicryptophytaie,"pelouses acidophiles alpines climaciques, chionophobes",Caricetalia curvulae subsp. curvulae Braun-Blanquet in Braun-Blanquet & Jenny 1926,,,,,9,1,4,4,4,3,1,0,5,1,9,1,,4,x,1,0,Magnoliopsida,Magnoliidae,Eudicots,Caryophyllanae,,,,Caryophyllales,Plumbaginaceae,0,0,2342,,,Armeria mar. alpina
83973,Asteraceae,"Artemisia genipi Weber, 1775","Artemisia genipi Weber, 1775",83973,"Artemisia genipi Weber, 1775",Artemisia genipi Weber,Artemisia genipi,775,esp,445,6862,08/20.0.2,Artemisia genipi Weber,orophyte méridional,épi de capitules,hermaphrodite,,anémogame,akène,barochore,blanc,,8-Jul,,,hces,hémicryptophytaie,"grpts vivaces des éboulis basophiles, psychrophiles, montagnards (ubacs) à alpins, héliophiles",Noccaeetalia rotundifoliae Braun-Blanquet in Braun-Blanquet & Jenny 1926 em. Seibert in Oberdorfer 1977,,,,,8,1,8,6,6,8,4,0,7,1,8,1,,6,8,?,0,Magnoliopsida,Magnoliidae,Eudicots,Asteranae,,,Asterids,Asterales,Asteraceae,0,0,1034,,,Arenaria grandiflora
84053,Asteraceae,"Artemisia umbelliformis Lam., 1783","Artemisia umbelliformis Lam., 1783",84053,"Artemisia umbelliformis Lam., 1783",Artemisia umbelliformis Lam.,Artemisia umbelliformis,784,esp,455,6977,08/2.2.1.0.10,Artemisia umbelliformis Lam.,orophyte méridional,épi de capitules,hermaphrodite,,anémogame,akène,barochore,,,,,,hces,hémicryptophytaie,"lithophytes des dalles en pente de falaises basophiles, subalpins à montagnards, alpiens et auvergnat",Potentillion caulescentis Braun-Blanquet in Braun-Blanquet & Jenny 1926,,,,,8,1,3,5,5,8,3,0,8,1,,,,,,,,Magnoliopsida,Magnoliidae,Eudicots,Asteranae,,,Asterids,Asterales,Asteraceae,0,0,3223,,,Artemisia glacialis
84526,Aspleniaceae,"Asplenium septentrionale (L.) Hoffm., 1796",Asplenium septentrionale,84526,"Asplenium septentrionale (L.) Hoffm., 1796",Asplenium septentrionale (L.) Hoffm.,Asplenium septentrionale,874,esp,29974,74982,07/2.0.3,Asplenium septentrionale (L.) Hoffm.,circumboréal,,monoïque,,hydrogame,,anémochore,,,,,,hces,hémicryptophytaie,"chasmophytes de parois européennes, acidophiles, planitiaires-montagnardes","Asplenietalia septentrionalis Oberdorfer, Görs, Korneck, Lohmeyer, Müller, Philippi & Seibert 1967 ex Loisel 1970",,,,,6,4,5,3,3,3,2,0,9,1,8,,4,3,2,2,0,Polypodiopsida,Magnoliidae,,Filicanae,,,,Polypodiales,Aspleniaceae,0,0,40,,,Asplenium septentrionale
84534,Aspleniaceae,"Asplenium trichomanes L., 1753",Asplenium trichomanes,84534,"Asplenium trichomanes L., 1753",Asplenium trichomanes L.,Asplenium trichomanes,876,esp,7358,7728,07/2.,Asplenium trichomanes L.,européen,,monoïque,,hydrogame,,anémochore,,,,,,hces,hémicryptophytaie,chasmophytes des parois européennes,Asplenietea trichomanis Braun-Blanquet in Meier & Braun-Blanquet 1934,,,,,6,5,5,6,4,5,3,0,9,1,5,,3,5,x,3,0,Polypodiopsida,Magnoliidae,,Filicanae,,,,Polypodiales,Aspleniaceae,0,0,42,,,Asplenium trichomanes
84540,Aspleniaceae,"Asplenium viride Huds., 1762","Asplenium viride Huds., 1762",84540,"Asplenium viride Huds., 1762",Asplenium viride Huds.,Asplenium viride,887,esp,7362,7765,07/2.0.6.0.1,Asplenium viride Huds.,orophyte circumboréal,,monoïque,,hydrogame,,anémochore,,,9-Jun,,,hces,hémicryptophytaie,"chasmophytes de parois européennes, basophiles, sciaphiles, psychrophiles, médio-européennes",Cystopteridion fragilis (Nordhagen 1936) Richard 1972,,,,,4,3,5,5,5,6,5,0,9,1,4,4,3,6,8,?,0,Polypodiopsida,Magnoliidae,,Filicanae,,,,Polypodiales,Aspleniaceae,0,0,43,,,Asplenium viride
84937,Apiaceae,"Astrantia minor L., 1753","Astrantia minor L., 1753",84937,"Astrantia minor L., 1753",Astrantia minor L.,Astrantia minor,966,esp,93,8212,09/1.0.2,Astrantia minor L.,orophyte méridional,ombelle d'ombellules,hermaphrodite,,entomogame,akène,épizoochore,blanc,,8-Jul,,,heri,hémicryptophytaie,pelouses acidophiles montagnardes à subalpines,Trifolio alpini - Meetalia athamantici de Foucault 1994,,,,,7,3,4,6,5,3,3,0,3,5,,,,,,,,Magnoliopsida,Magnoliidae,Eudicots,Asteranae,,,Asterids,Apiales,Apiaceae,0,0,2136,,,Astrantia minor
84998,Athyriaceae,"Athyrium distentifolium Tausch ex Opiz, 1820","Athyrium distentifolium Tausch ex Opiz, 1820",84998,"Athyrium distentifolium Tausch ex Opiz, 1820",Athyrium distentifolium Tausch ex Opiz,Athyrium distentifolium,968,esp,7465,8285,05/1.0.1.0.3,Athyrium distentifolium Tausch ex Opiz,circumboréal,,monoïque,,hydrogame,,autochore,,,9-Jul,,,Hces,hémicryptophytaie,"mégaphorbiaies boréales à subalpines, ombragées","Dryopterido filicis-maris - Athyrion distentifolii Holub in Holub, Hejný, Moravec & Neuhäusl 1967",,,,,5,2,6,8,6,5,6,0,3,8,5,3,3,6,6,7,0,Polypodiopsida,Polypodiidae,,Filicanae,,,,Filicales s. l.,Woodsiaceae,0,0,31,,,Athyrium distentifolium
84999,Athyriaceae,"Athyrium filix-femina (L.) Roth, 1799","Athyrium filix-femina (L.) Roth, 1799",84999,"Athyrium filix-femina (L.) Roth, 1799",Athyrium filix-femina (L.) Roth,Athyrium filix-femina,969,esp,7466,8286,13/2.0.2,Athyrium filix-femina (L.) Roth,circumboréal,,monoïque,,hydrogame,,autochore,,,9-Jun,,,Hces,hémicryptophytaie,"ourlets internes et clairières vivaces médio-européennes, eutrophiles, mésohygrophiles",Circaeo lutetianae - Stachyetalia sylvaticae Passarge 1967,,,,,3,5,5,8,7,5,6,0,2,8,3,,3,7,x,6,0,Polypodiopsida,Polypodiidae,,Filicanae,,,,Filicales s. l.,Woodsiaceae,0,0,30,,,Athyrium filix-femina
